[
  {
    "organism_id": "ORG-SYNTH-001",
    "record_type": "synthetic",
    "species": "Mus musculus",
    "taxon_id": "NCBI:10090",
    "breed_strain": "synthetic lab strain",
    "sex": "male",
    "age_value": 90,
    "age_unit": "days",
    "developmental_stage": "adult",
    "body_mass": 28.4,
    "body_mass_unit": "g",
    "body_length": "NA_NOT_REPORTED",
    "body_length_unit": "NA_NOT_REPORTED",
    "reproductive_status": "unknown",
    "generation": "synthetic generation 0",
    "environment": "synthetic",
    "geography": "generalized synthetic",
    "ethics_status": "synthetic"
  },
  {
    "organism_id": "ORG-SYNTH-002",
    "record_type": "synthetic",
    "species": "Mus musculus",
    "taxon_id": "NCBI:10090",
    "breed_strain": "synthetic lab strain",
    "sex": "female",
    "age_value": 90,
    "age_unit": "days",
    "developmental_stage": "adult",
    "body_mass": 23.1,
    "body_mass_unit": "g",
    "body_length": "NA_NOT_REPORTED",
    "body_length_unit": "NA_NOT_REPORTED",
    "reproductive_status": "unknown",
    "generation": "synthetic generation 0",
    "environment": "synthetic",
    "geography": "generalized synthetic",
    "ethics_status": "synthetic"
  },
  {
    "organism_id": "ORG-SYNTH-003",
    "record_type": "synthetic",
    "species": "Homo sapiens",
    "taxon_id": "NCBI:9606",
    "breed_strain": "synthetic neonatal aggregate",
    "sex": "mixed",
    "age_value": 39,
    "age_unit": "gestational_weeks",
    "developmental_stage": "neonate",
    "body_mass": 3325.0,
    "body_mass_unit": "g",
    "body_length": "NA_NOT_REPORTED",
    "body_length_unit": "NA_NOT_REPORTED",
    "reproductive_status": "not_applicable",
    "generation": "NA_NOT_APPLICABLE",
    "environment": "synthetic",
    "geography": "generalized synthetic",
    "ethics_status": "synthetic"
  }
]

